{
  "app_ready": false,
  "blocked_rule_count": 33,
  "draft_unverified_rule_count": 33,
  "grade": "not_grade_a",
  "methodology": "Verra/VM0007@v1-8",
  "methodology_linked_review_ready": false,
  "next_upgrade_target": "Dependency/module strategy before app readiness. 33 rules blocked by unencoded Verra modules/tools. Deeper subsection hierarchy still unmapped.",
  "rule_count": 58,
  "section_count": 32,
  "source_audited_rule_count": 25,
  "unresolved_external_dependencies": [
    "Verra/T-BAR@v1-8",
    "Verra/T-SIG@v1-8",
    "Verra/VM0047@v1-8",
    "Verra/VMD0001@v1-8",
    "Verra/VMD0002@v1-8",
    "Verra/VMD0003@v1-8",
    "Verra/VMD0004@v1-8",
    "Verra/VMD0005@v1-8",
    "Verra/VMD0006@v1-8",
    "Verra/VMD0007@v1-8",
    "Verra/VMD0009@v1-8",
    "Verra/VMD0010@v1-8",
    "Verra/VMD0015@v1-8",
    "Verra/VMD0016@v1-8",
    "Verra/VMD0017@v1-8",
    "Verra/VMD0042@v1-8",
    "Verra/VMD0046@v1-8",
    "Verra/VMD0050@v1-8",
    "Verra/VMD0051@v1-8",
    "Verra/VMD0052@v1-8",
    "Verra/VT0001@v1-8"
  ]
}
