{
  "app_ready": true,
  "blocked_rule_count": 0,
  "draft_unverified_rule_count": 0,
  "grade": "grade_a",
  "methodology": "Verra/VM0047@v1-0",
  "methodology_linked_review_ready": true,
  "next_upgrade_target": "Maintain Grade A as external dependencies evolve",
  "rule_count": 11,
  "section_count": 27,
  "source_audited_rule_count": 11,
  "unresolved_external_dependencies": []
}
